{
  "$schema": "https://cubixflow.ir/schema/registry-item.json",
  "name": "progress",
  "type": "registry:ui",
  "title": "Progress",
  "description": "Displays an indicator showing the completion progress of a task.",
  "dependencies": [
    "radix-ui"
  ],
  "registryDependencies": [],
  "files": [
    {
      "path": "components/cubix/progress.tsx",
      "type": "registry:ui",
      "target": "components/cubix/progress.tsx",
      "content": "\"use client\"\n\nimport * as React from \"react\"\nimport { Progress as ProgressPrimitive } from \"radix-ui\"\n\nimport { cn } from \"@/lib/utils\"\n\nconst DEFAULT_MAX = 100\n\ntype ProgressContextValue = {\n  percentage: number | null\n  registerLabel: (id: string) => () => void\n}\n\nconst ProgressContext = React.createContext<ProgressContextValue>({\n  percentage: null,\n  registerLabel: () => () => {},\n})\n\nfunction toPercentage(value: number | null | undefined, max: number) {\n  if (value == null || Number.isNaN(value) || max <= 0) return null\n  return Math.min(100, Math.max(0, (value / max) * 100))\n}\n\nfunction Progress({\n  className,\n  children,\n  value,\n  max = DEFAULT_MAX,\n  \"aria-labelledby\": ariaLabelledBy,\n  ...props\n}: React.ComponentProps<typeof ProgressPrimitive.Root>) {\n  const [labelId, setLabelId] = React.useState<string>()\n  const registerLabel = React.useCallback((id: string) => {\n    setLabelId(id)\n    return () => setLabelId((current) => (current === id ? undefined : current))\n  }, [])\n  const percentage = toPercentage(value, max)\n\n  return (\n    <ProgressContext.Provider value={{ percentage, registerLabel }}>\n      <div\n        data-slot=\"progress\"\n        className={cn(\"flex w-full flex-wrap gap-3\", className)}\n      >\n        {children}\n        <ProgressPrimitive.Root\n          data-slot=\"progress-track\"\n          className=\"relative flex h-1 w-full items-center overflow-x-hidden rounded-full bg-muted\"\n          value={value}\n          max={max}\n          aria-labelledby={ariaLabelledBy ?? labelId}\n          {...props}\n        >\n          <ProgressPrimitive.Indicator\n            data-slot=\"progress-indicator\"\n            className=\"h-full bg-primary transition-all\"\n            style={{ width: `${percentage ?? 0}%` }}\n          />\n        </ProgressPrimitive.Root>\n      </div>\n    </ProgressContext.Provider>\n  )\n}\n\nfunction ProgressTrack({ className, ...props }: React.ComponentProps<\"div\">) {\n  return (\n    <div\n      data-slot=\"progress-track\"\n      className={cn(\n        \"relative flex h-1 w-full items-center overflow-x-hidden rounded-full bg-muted\",\n        className\n      )}\n      {...props}\n    />\n  )\n}\n\nfunction ProgressIndicator({\n  className,\n  style,\n  ...props\n}: React.ComponentProps<\"div\">) {\n  const { percentage } = React.useContext(ProgressContext)\n\n  return (\n    <div\n      data-slot=\"progress-indicator\"\n      className={cn(\"h-full bg-primary transition-all\", className)}\n      style={{ width: `${percentage ?? 0}%`, ...style }}\n      {...props}\n    />\n  )\n}\n\nfunction ProgressLabel({ className, id, ...props }: React.ComponentProps<\"span\">) {\n  const generatedId = React.useId()\n  const labelId = id ?? generatedId\n  const { registerLabel } = React.useContext(ProgressContext)\n\n  React.useLayoutEffect(() => registerLabel(labelId), [registerLabel, labelId])\n\n  return (\n    <span\n      id={labelId}\n      data-slot=\"progress-label\"\n      className={cn(\"text-description font-medium\", className)}\n      {...props}\n    />\n  )\n}\n\nfunction ProgressValue({\n  className,\n  children,\n  ...props\n}: React.ComponentProps<\"span\">) {\n  const { percentage } = React.useContext(ProgressContext)\n  const formatted = percentage == null ? null : `${Math.round(percentage)}%`\n\n  return (\n    <span\n      data-slot=\"progress-value\"\n      className={cn(\n        \"ms-auto text-description text-muted-foreground tabular-nums\",\n        className\n      )}\n      {...props}\n    >\n      {children ?? formatted}\n    </span>\n  )\n}\n\nexport {\n  Progress,\n  ProgressTrack,\n  ProgressIndicator,\n  ProgressLabel,\n  ProgressValue,\n}\n"
    }
  ]
}

