{
  "$schema": "https://cubixflow.ir/schema/registry-item.json",
  "name": "checkbox",
  "type": "registry:ui",
  "title": "Checkbox",
  "description": "A control that toggles between checked, unchecked, and indeterminate. Compose with Label via id and htmlFor.",
  "dependencies": [
    "radix-ui"
  ],
  "registryDependencies": [],
  "files": [
    {
      "path": "components/cubix/checkbox.tsx",
      "type": "registry:ui",
      "target": "components/cubix/checkbox.tsx",
      "content": "\"use client\"\n\n/*\n  Cubix Checkbox - toggle control for checked, unchecked, and indeterminate.\n\n  Composes with Label via id / htmlFor. Values and states use Cubix tokens.\n  indeterminate maps to Radix checked=\"indeterminate\" for API parity with Base UI.\n  Set pending while an async save is in flight to replace the box with a spinner.\n*/\nimport * as React from \"react\"\nimport { Checkbox as CheckboxPrimitive } from \"radix-ui\"\nimport { CheckIcon, Loader2Icon, MinusIcon } from \"lucide-react\"\n\nimport { cn } from \"@/lib/utils\"\n\ntype CubixCheckboxProps = Omit<\n  React.ComponentProps<typeof CheckboxPrimitive.Root>,\n  \"checked\" | \"defaultChecked\" | \"onCheckedChange\"\n> & {\n  checked?: boolean\n  defaultChecked?: boolean\n  indeterminate?: boolean\n  pending?: boolean\n  onCheckedChange?: (checked: boolean) => void\n}\n\nfunction Checkbox({\n  className,\n  checked,\n  defaultChecked,\n  indeterminate = false,\n  pending = false,\n  disabled,\n  onCheckedChange,\n  ...props\n}: CubixCheckboxProps) {\n  return (\n    <CheckboxPrimitive.Root\n      data-slot=\"checkbox\"\n      data-pending={pending ? \"\" : undefined}\n      disabled={disabled || pending}\n      aria-busy={pending || undefined}\n      className={cn(\n        \"group/checkbox peer relative flex size-[18px] shrink-0 items-center justify-center rounded-[6px] border border-input transition-[background-color,border-color] outline-none group-has-disabled/field:opacity-50 group-has-[:focus-visible]/field-label:ring-0 group-has-[:focus-visible]/field-label:not-data-[state=checked]:border-input after:absolute after:-inset-x-3 after:-inset-y-2 focus-visible:ring-3 focus-visible:ring-secondary focus-visible:ring-offset-1 focus-visible:ring-offset-background disabled:cursor-not-allowed disabled:data-[state=checked]:opacity-50 disabled:data-[state=indeterminate]:opacity-50 data-[disabled]:cursor-not-allowed data-[disabled]:data-[state=checked]:opacity-50 data-[disabled]:data-[state=indeterminate]:opacity-50 dark:bg-input/30 aria-invalid:border-destructive aria-invalid:ring-3 aria-invalid:ring-destructive/20 dark:aria-invalid:border-destructive/50 dark:aria-invalid:ring-destructive/40 data-[state=checked]:border-primary data-[state=checked]:bg-primary data-[state=checked]:text-primary-foreground data-[state=checked]:focus-visible:ring-primary/20 data-[state=indeterminate]:border-primary data-[state=indeterminate]:bg-primary data-[state=indeterminate]:text-primary-foreground data-[state=indeterminate]:focus-visible:ring-primary/20 group-has-[:focus-visible]/field-label:data-[state=checked]:border-primary dark:data-[state=checked]:bg-primary dark:data-[state=indeterminate]:bg-primary data-[pending]:cursor-wait data-[pending]:border-transparent data-[pending]:bg-transparent data-[pending]:text-muted-foreground data-[pending]:opacity-100 data-[pending]:data-[state=checked]:border-transparent data-[pending]:data-[state=checked]:bg-transparent data-[pending]:data-[state=checked]:text-muted-foreground data-[pending]:data-[state=indeterminate]:border-transparent data-[pending]:data-[state=indeterminate]:bg-transparent data-[pending]:data-[state=indeterminate]:text-muted-foreground dark:data-[pending]:bg-transparent\",\n        className\n      )}\n      {...props}\n      checked={indeterminate ? \"indeterminate\" : checked}\n      defaultChecked={defaultChecked}\n      onCheckedChange={(value) => {\n        onCheckedChange?.(value === true)\n      }}\n    >\n      {pending ? (\n        <span data-slot=\"checkbox-indicator\" className=\"grid place-content-center text-current\">\n          <Loader2Icon\n            absoluteStrokeWidth\n            size={18}\n            strokeWidth={1.6}\n            className=\"animate-spin\"\n            aria-hidden\n          />\n        </span>\n      ) : (\n        <CheckboxPrimitive.Indicator\n          data-slot=\"checkbox-indicator\"\n          className=\"grid place-content-center text-primary-foreground transition-none\"\n        >\n          {indeterminate ? (\n            <MinusIcon absoluteStrokeWidth size={12} strokeWidth={1.6} />\n          ) : (\n            <CheckIcon absoluteStrokeWidth size={12} strokeWidth={1.6} />\n          )}\n        </CheckboxPrimitive.Indicator>\n      )}\n    </CheckboxPrimitive.Root>\n  )\n}\n\nexport { Checkbox }\n"
    }
  ]
}

