{
  "$schema": "https://cubixflow.ir/schema/registry-item.json",
  "name": "button-group",
  "type": "registry:ui",
  "title": "Button Group",
  "description": "A container that groups related buttons together with consistent styling.",
  "dependencies": [
    "@base-ui/react"
  ],
  "registryDependencies": [
    "separator"
  ],
  "files": [
    {
      "path": "components/cubix/button-group.tsx",
      "type": "registry:ui",
      "target": "components/cubix/button-group.tsx",
      "content": "\"use client\"\n\nimport * as React from \"react\"\nimport { mergeProps } from \"@base-ui/react/merge-props\"\nimport { useRender } from \"@base-ui/react/use-render\"\nimport { cva, type VariantProps } from \"class-variance-authority\"\n\nimport { Separator } from \"@/components/cubix/separator\"\nimport { cn } from \"@/lib/utils\"\n\nconst buttonGroupVariants = cva(\n  \"group/button-group flex w-fit items-stretch *:focus-visible:relative *:focus-visible:z-10 [&>[data-slot=select]>[data-slot=select-trigger]:focus-visible]:relative [&>[data-slot=select]>[data-slot=select-trigger]:focus-visible]:z-10 has-[>[data-slot=button-group]]:gap-2 has-[select[aria-hidden=true]:last-child]:[&>[data-slot=select-trigger]:last-of-type]:rounded-e-lg [&>[data-slot=select-trigger]:not([class*='w-'])]:w-fit [&>input]:flex-1\",\n  {\n    variants: {\n      orientation: {\n        horizontal:\n          \"*:data-slot:rounded-e-none [&>[data-slot]:not(:has(~[data-slot]))]:rounded-e-lg! [&>[data-slot]~[data-slot]]:rounded-s-none [&>[data-slot]~[data-slot]]:border-s-0 [&>[data-slot=select]:has(~[data-slot])>[data-slot=select-trigger]]:rounded-e-none [&>[data-slot]~[data-slot=select]>[data-slot=select-trigger]]:rounded-s-none [&>[data-slot]~[data-slot=select]>[data-slot=select-trigger]]:border-s-0\",\n        vertical:\n          \"flex-col *:data-slot:rounded-b-none [&>[data-slot]:not(:has(~[data-slot]))]:rounded-b-lg! [&>[data-slot]~[data-slot]]:rounded-t-none [&>[data-slot]~[data-slot]]:border-t-0 [&>[data-slot=select]:has(~[data-slot])>[data-slot=select-trigger]]:rounded-b-none [&>[data-slot]~[data-slot=select]>[data-slot=select-trigger]]:rounded-t-none [&>[data-slot]~[data-slot=select]>[data-slot=select-trigger]]:border-t-0\",\n      },\n    },\n    defaultVariants: {\n      orientation: \"horizontal\",\n    },\n  }\n)\n\nfunction ButtonGroup({\n  className,\n  orientation,\n  ...props\n}: React.ComponentProps<\"div\"> & VariantProps<typeof buttonGroupVariants>) {\n  return (\n    <div\n      role=\"group\"\n      data-slot=\"button-group\"\n      data-orientation={orientation}\n      className={cn(buttonGroupVariants({ orientation }), className)}\n      {...props}\n    />\n  )\n}\n\nfunction ButtonGroupText({ className, render, ...props }: useRender.ComponentProps<\"div\">) {\n  return useRender({\n    defaultTagName: \"div\",\n    props: mergeProps<\"div\">(\n      {\n        className: cn(\n          \"flex items-center gap-2 rounded-lg border bg-muted px-2.5 text-description font-medium [&_svg]:pointer-events-none [&_svg:not([class*='size-'])]:size-4\",\n          className\n        ),\n      },\n      props\n    ),\n    render,\n    state: {\n      slot: \"button-group-text\",\n    },\n  })\n}\n\nfunction ButtonGroupSeparator({\n  className,\n  orientation = \"vertical\",\n  ...props\n}: React.ComponentProps<typeof Separator>) {\n  return (\n    <Separator\n      data-slot=\"button-group-separator\"\n      orientation={orientation}\n      className={cn(\n        \"relative self-stretch bg-input data-horizontal:mx-px data-horizontal:w-auto data-vertical:my-px data-vertical:h-auto\",\n        className\n      )}\n      {...props}\n    />\n  )\n}\n\nexport { ButtonGroup, ButtonGroupSeparator, ButtonGroupText, buttonGroupVariants }\n"
    }
  ]
}

