{
  "$schema": "https://cubixflow.ir/schema/registry-item.json",
  "name": "popover",
  "type": "registry:ui",
  "title": "Popover",
  "description": "Displays rich content in a portal, triggered by a button.",
  "dependencies": [
    "radix-ui"
  ],
  "registryDependencies": [],
  "files": [
    {
      "path": "components/cubix/popover.tsx",
      "type": "registry:ui",
      "target": "components/cubix/popover.tsx",
      "content": "\"use client\"\n\n/*\n  Cubix Popover - Radix UI version.\n\n  Persian-first: popovers start right-to-left. The trigger reports the closest\n  dir on the page and the portaled content shares it. An explicit dir prop on\n  Popover always wins. Opening does not steal focus into the panel; users can\n  still tab into interactive content.\n*/\nimport * as React from \"react\"\nimport { cn } from \"@/lib/utils\"\nimport { Direction, Popover as PopoverPrimitive } from \"radix-ui\"\n\ntype Dir = \"ltr\" | \"rtl\"\n\nconst PopoverDirContext = React.createContext<{\n  dir: Dir\n  lang?: string\n  report: (dir: Dir, lang?: string) => void\n}>({ dir: \"rtl\", report: () => {} })\n\nfunction Popover({\n  dir,\n  ...props\n}: React.ComponentProps<typeof PopoverPrimitive.Root> & { dir?: Dir }) {\n  const [pageDir, setPageDir] = React.useState<Dir>(\"rtl\")\n  const [pageLang, setPageLang] = React.useState<string | undefined>()\n  const report = React.useCallback((d: Dir, l?: string) => {\n    setPageDir(d)\n    setPageLang(l)\n  }, [])\n  const resolved = dir ?? pageDir\n  const value = React.useMemo(\n    () => ({ dir: resolved, lang: pageLang, report }),\n    [resolved, pageLang, report]\n  )\n\n  return (\n    <PopoverDirContext.Provider value={value}>\n      <Direction.Provider dir={resolved}>\n        <PopoverPrimitive.Root data-slot=\"popover\" {...props} />\n      </Direction.Provider>\n    </PopoverDirContext.Provider>\n  )\n}\n\n/*\n  render={<Button variant=\"outline\" />} composes the trigger or close with\n  another element, the same API as the Base UI and React Aria versions.\n  asChild works as well.\n*/\ntype ComposableProps = {\n  render?: React.ReactElement<Record<string, unknown>>\n}\n\nfunction PopoverTrigger({\n  ref,\n  render,\n  asChild,\n  children,\n  ...props\n}: React.ComponentProps<typeof PopoverPrimitive.Trigger> & ComposableProps) {\n  const { report } = React.useContext(PopoverDirContext)\n  const nodeRef = React.useRef<HTMLElement | null>(null)\n  const setRef = React.useCallback(\n    (node: HTMLButtonElement | null) => {\n      nodeRef.current = node\n      if (typeof ref === \"function\") ref(node)\n      else if (ref) ref.current = node\n    },\n    [ref]\n  )\n\n  React.useLayoutEffect(() => {\n    const parent = nodeRef.current?.parentElement\n    const closest = parent?.closest(\"[dir]\")?.getAttribute(\"dir\")\n    const lang = parent?.closest(\"[lang]\")?.getAttribute(\"lang\") ?? undefined\n    if (closest === \"ltr\" || closest === \"rtl\") report(closest, lang)\n  }, [report])\n\n  return (\n    <PopoverPrimitive.Trigger\n      ref={setRef}\n      data-slot=\"popover-trigger\"\n      asChild={asChild || render !== undefined}\n      {...props}\n    >\n      {render\n        ? children === undefined\n          ? render\n          : React.cloneElement(render, undefined, children)\n        : children}\n    </PopoverPrimitive.Trigger>\n  )\n}\n\nfunction PopoverContent({\n  className,\n  align = \"center\",\n  sideOffset = 4,\n  ...props\n}: React.ComponentProps<typeof PopoverPrimitive.Content>) {\n  const { dir, lang } = React.useContext(PopoverDirContext)\n  const resolvedLang = lang ?? (dir === \"rtl\" ? \"fa\" : undefined)\n\n  /*\n    Radix positions via floating-ui, which reads the floating element's\n    computed direction: with dir on the content, align/alignOffset become\n    logical on their own (ابتدا = right edge in RTL). No manual swap.\n  */\n  return (\n    <PopoverPrimitive.Portal>\n      <PopoverPrimitive.Content\n        data-slot=\"popover-content\"\n        dir={dir}\n        lang={resolvedLang}\n        align={align}\n        sideOffset={sideOffset}\n        onOpenAutoFocus={(event) => event.preventDefault()}\n        className={cn(\n          \"z-50 flex w-60 origin-(--radix-popover-content-transform-origin) flex-col gap-2.5 rounded-lg bg-popover p-2.5 text-label text-popover-foreground shadow-md ring-1 ring-foreground/10 outline-hidden duration-100 data-[side=bottom]:slide-in-from-top-2 data-[side=left]:slide-in-from-right-2 data-[side=right]:slide-in-from-left-2 data-[side=top]:slide-in-from-bottom-2 data-[state=open]:animate-in data-[state=open]:fade-in-0 data-[state=open]:zoom-in-95 data-[state=closed]:animate-out data-[state=closed]:fade-out-0 data-[state=closed]:zoom-out-95\",\n          className\n        )}\n        {...props}\n      />\n    </PopoverPrimitive.Portal>\n  )\n}\n\nfunction PopoverClose({\n  render,\n  asChild,\n  children,\n  ...props\n}: React.ComponentProps<typeof PopoverPrimitive.Close> & ComposableProps) {\n  return (\n    <PopoverPrimitive.Close\n      data-slot=\"popover-close\"\n      asChild={asChild || render !== undefined}\n      {...props}\n    >\n      {render\n        ? children === undefined\n          ? render\n          : React.cloneElement(render, undefined, children)\n        : children}\n    </PopoverPrimitive.Close>\n  )\n}\n\nfunction PopoverAnchor({ ...props }: React.ComponentProps<typeof PopoverPrimitive.Anchor>) {\n  return <PopoverPrimitive.Anchor data-slot=\"popover-anchor\" {...props} />\n}\n\nfunction PopoverHeader({ className, ...props }: React.ComponentProps<\"div\">) {\n  return (\n    <div\n      data-slot=\"popover-header\"\n      className={cn(\"flex flex-col gap-0.5 text-label\", className)}\n      {...props}\n    />\n  )\n}\n\nfunction PopoverTitle({ className, ...props }: React.ComponentProps<\"h2\">) {\n  return (\n    <h2 data-slot=\"popover-title\" className={cn(\"font-medium text-label\", className)} {...props} />\n  )\n}\n\nfunction PopoverDescription({ className, ...props }: React.ComponentProps<\"p\">) {\n  return (\n    <p\n      data-slot=\"popover-description\"\n      className={cn(\"text-label text-muted-foreground\", className)}\n      {...props}\n    />\n  )\n}\n\nexport {\n  Popover,\n  PopoverAnchor,\n  PopoverClose,\n  PopoverContent,\n  PopoverDescription,\n  PopoverHeader,\n  PopoverTitle,\n  PopoverTrigger,\n}\n"
    }
  ]
}

