{
  "$schema": "https://cubixflow.ir/schema/registry-item.json",
  "name": "alert-dialog",
  "type": "registry:ui",
  "title": "Alert Dialog",
  "description": "A modal dialog that interrupts the user with important content and expects a response.",
  "dependencies": [
    "react-aria-components"
  ],
  "registryDependencies": [
    "button"
  ],
  "files": [
    {
      "path": "components/cubix/alert-dialog.tsx",
      "type": "registry:ui",
      "target": "components/cubix/alert-dialog.tsx",
      "content": "\"use client\"\n\n/*\n  Cubix Alert Dialog - React Aria version.\n\n  Persian-first: the portaled panel defaults to dir=\"rtl\" lang=\"fa\" so the\n  dialog follows Persian regardless of the portal position. Pass dir=\"ltr\"\n  on AlertDialogContent to switch.\n*/\nimport {\n  useLayoutEffect,\n  useRef,\n  type ComponentProps,\n  type ReactElement,\n  type ReactNode,\n} from \"react\"\nimport {\n  Button as AriaButton,\n  Dialog,\n  DialogTrigger,\n  Heading,\n  Modal,\n  ModalOverlay,\n  Text,\n  type ButtonProps,\n  type DialogTriggerProps,\n  type ModalOverlayProps,\n} from \"react-aria-components\"\n\nimport { buttonVariants } from \"@/components/cubix/button\"\nimport { cn } from \"@/lib/utils\"\n\nfunction AlertDialog({\n  children,\n  open,\n  defaultOpen,\n  onOpenChange,\n  ...props\n}: Omit<DialogTriggerProps, \"isOpen\" | \"defaultOpen\" | \"onOpenChange\"> & {\n  open?: boolean\n  defaultOpen?: boolean\n  onOpenChange?: (open: boolean) => void\n  children?: ReactNode\n}) {\n  return (\n    <DialogTrigger\n      data-slot=\"alert-dialog\"\n      isOpen={open}\n      defaultOpen={defaultOpen}\n      onOpenChange={onOpenChange}\n      {...props}\n    >\n      {children}\n    </DialogTrigger>\n  )\n}\n\ntype TriggerRenderProps = {\n  variant?:\n    | \"default\"\n    | \"secondary\"\n    | \"gray\"\n    | \"destructive\"\n    | \"destructive-secondary\"\n    | \"outline\"\n    | \"ghost\"\n    | \"link\"\n  size?: \"default\" | \"xs\" | \"sm\" | \"lg\" | \"icon\" | \"icon-xs\" | \"icon-sm\" | \"icon-lg\"\n  className?: string\n}\n\ntype AlertDialogTriggerProps = Omit<ButtonProps, \"children\" | \"className\" | \"render\"> & {\n  render?: ReactElement<TriggerRenderProps>\n  className?: string\n  children?: ReactNode\n}\n\nfunction AlertDialogTrigger({ render, className, children, ...props }: AlertDialogTriggerProps) {\n  return (\n    <AriaButton\n      data-slot=\"alert-dialog-trigger\"\n      className={cn(\n        buttonVariants({\n          variant: render?.props.variant ?? \"outline\",\n          size: render?.props.size ?? \"default\",\n        }),\n        render?.props.className,\n        className\n      )}\n      {...props}\n    >\n      {children}\n    </AriaButton>\n  )\n}\n\nfunction AlertDialogPortal({ children }: { children?: ReactNode }) {\n  return children\n}\n\nfunction AlertDialogOverlay({\n  className,\n  ...props\n}: Omit<ModalOverlayProps, \"className\"> & { className?: string }) {\n  return (\n    <ModalOverlay\n      data-slot=\"alert-dialog-overlay\"\n      isDismissable={false}\n      className={cn(\n        \"fixed inset-0 isolate z-50 bg-overlay-strong duration-100 data-entering:animate-in data-entering:fade-in-0 data-exiting:animate-out data-exiting:fade-out-0\",\n        className\n      )}\n      {...props}\n    />\n  )\n}\n\nfunction AlertDialogContent({\n  className,\n  size = \"default\",\n  dir = \"rtl\",\n  lang = \"fa\",\n  children,\n  ...props\n}: Omit<ModalOverlayProps, \"className\" | \"children\"> & {\n  className?: string\n  size?: \"default\" | \"sm\"\n  dir?: \"ltr\" | \"rtl\"\n  lang?: string\n  children?: ReactNode\n}) {\n  return (\n    <AlertDialogOverlay>\n      <Modal\n        data-slot=\"alert-dialog-content\"\n        data-size={size}\n        dir={dir}\n        lang={dir === \"rtl\" ? lang : undefined}\n        className={cn(\n          \"group/alert-dialog-content fixed top-1/2 left-1/2 z-50 grid w-full -translate-x-1/2 -translate-y-1/2 gap-4 rounded-xl bg-popover p-4 text-popover-foreground ring-1 ring-foreground/10 duration-100 outline-none data-[size=default]:max-w-xs data-[size=sm]:max-w-xs data-[size=default]:sm:max-w-sm data-entering:animate-in data-entering:fade-in-0 data-entering:zoom-in-95 data-exiting:animate-out data-exiting:fade-out-0 data-exiting:zoom-out-95\",\n          className\n        )}\n        {...props}\n      >\n        <Dialog role=\"alertdialog\" className=\"contents\">\n          {children}\n        </Dialog>\n      </Modal>\n    </AlertDialogOverlay>\n  )\n}\n\nfunction AlertDialogHeader({ className, ...props }: ComponentProps<\"div\">) {\n  return (\n    <div\n      data-slot=\"alert-dialog-header\"\n      className={cn(\n        \"grid grid-rows-[auto_1fr] place-items-center gap-1.5 text-center has-data-[slot=alert-dialog-media]:grid-rows-[auto_auto_1fr] has-data-[slot=alert-dialog-media]:gap-x-4 sm:group-data-[size=default]/alert-dialog-content:place-items-start sm:group-data-[size=default]/alert-dialog-content:text-start sm:group-data-[size=default]/alert-dialog-content:has-data-[slot=alert-dialog-media]:grid-rows-[auto_1fr]\",\n        className\n      )}\n      {...props}\n    />\n  )\n}\n\nfunction AlertDialogFooter({ className, ...props }: ComponentProps<\"div\">) {\n  const ref = useRef<HTMLDivElement>(null)\n\n  useLayoutEffect(() => {\n    const row = ref.current\n    if (!row) return\n\n    const equalize = () => {\n      if (!row.isConnected) return\n      const controls = Array.from(row.children) as HTMLElement[]\n      if (controls.length < 2) return\n      controls.forEach((el) => el.style.removeProperty(\"min-width\"))\n      const max = Math.max(...controls.map((el) => el.offsetWidth))\n      controls.forEach((el) => el.style.setProperty(\"min-width\", `${max}px`))\n    }\n\n    equalize()\n    document.fonts?.ready.then(equalize)\n    const observer = new ResizeObserver(equalize)\n    observer.observe(row)\n    return () => observer.disconnect()\n  }, [])\n\n  return (\n    <div\n      ref={ref}\n      data-slot=\"alert-dialog-footer\"\n      className={cn(\n        \"-mx-4 -mb-4 flex flex-col-reverse gap-2 rounded-b-xl border-t bg-muted/50 p-4 group-data-[size=sm]/alert-dialog-content:grid group-data-[size=sm]/alert-dialog-content:grid-cols-2 sm:flex-row sm:justify-end\",\n        className\n      )}\n      {...props}\n    />\n  )\n}\n\nfunction AlertDialogMedia({ className, ...props }: ComponentProps<\"div\">) {\n  return (\n    <div\n      data-slot=\"alert-dialog-media\"\n      className={cn(\n        \"mb-2 inline-flex size-10 items-center justify-center rounded-md bg-muted sm:group-data-[size=default]/alert-dialog-content:row-span-2 *:[svg:not([class*='size-'])]:size-6\",\n        className\n      )}\n      {...props}\n    />\n  )\n}\n\nfunction AlertDialogTitle({ className, ...props }: ComponentProps<typeof Heading>) {\n  return (\n    <Heading\n      slot=\"title\"\n      data-slot=\"alert-dialog-title\"\n      className={cn(\n        \"cn-font-heading text-title font-medium sm:group-data-[size=default]/alert-dialog-content:group-has-data-[slot=alert-dialog-media]/alert-dialog-content:col-start-2\",\n        className\n      )}\n      {...props}\n    />\n  )\n}\n\nfunction AlertDialogDescription({\n  className,\n  ...props\n}: Omit<ComponentProps<typeof Text>, \"slot\" | \"elementType\">) {\n  return (\n    <Text\n      slot=\"description\"\n      elementType=\"p\"\n      data-slot=\"alert-dialog-description\"\n      className={cn(\n        \"text-description text-balance text-muted-foreground md:text-pretty *:[a]:underline *:[a]:underline-offset-3 *:[a]:hover:text-foreground\",\n        className\n      )}\n      {...props}\n    />\n  )\n}\n\ntype AlertDialogButtonProps = Omit<ButtonProps, \"className\" | \"children\" | \"slot\"> & {\n  className?: string\n  variant?: TriggerRenderProps[\"variant\"]\n  size?: TriggerRenderProps[\"size\"]\n  children?: ReactNode\n}\n\nfunction AlertDialogAction({\n  className,\n  variant = \"default\",\n  size = \"sm\",\n  children,\n  ...props\n}: AlertDialogButtonProps) {\n  return (\n    <AriaButton\n      slot=\"close\"\n      data-slot=\"alert-dialog-action\"\n      className={cn(buttonVariants({ variant, size }), className)}\n      {...props}\n    >\n      {children}\n    </AriaButton>\n  )\n}\n\nfunction AlertDialogCancel({\n  className,\n  variant = \"outline\",\n  size = \"sm\",\n  children,\n  ...props\n}: AlertDialogButtonProps) {\n  return (\n    <AriaButton\n      slot=\"close\"\n      data-slot=\"alert-dialog-cancel\"\n      className={cn(buttonVariants({ variant, size }), className)}\n      {...props}\n    >\n      {children}\n    </AriaButton>\n  )\n}\n\nexport {\n  AlertDialog,\n  AlertDialogAction,\n  AlertDialogCancel,\n  AlertDialogContent,\n  AlertDialogDescription,\n  AlertDialogFooter,\n  AlertDialogHeader,\n  AlertDialogMedia,\n  AlertDialogOverlay,\n  AlertDialogPortal,\n  AlertDialogTitle,\n  AlertDialogTrigger,\n}\n"
    }
  ]
}

