{
  "$schema": "https://cubixflow.ir/schema/registry-item.json",
  "name": "sheet",
  "type": "registry:ui",
  "title": "Sheet",
  "description": "Extends the Dialog to display content that complements the main content of the screen.",
  "dependencies": [
    "radix-ui"
  ],
  "registryDependencies": [
    "button"
  ],
  "files": [
    {
      "path": "components/cubix/sheet.tsx",
      "type": "registry:ui",
      "target": "components/cubix/sheet.tsx",
      "content": "\"use client\"\n\n/*\n  Cubix Sheet - Radix UI version.\n\n  Persian-first: the portaled panel defaults to dir=\"rtl\" lang=\"fa\" so the\n  sheet follows Persian regardless of the portal position. Pass dir=\"ltr\"\n  on SheetContent to switch.\n*/\nimport * as React from \"react\"\n\nconst SheetChromeContext = React.createContext({ showCloseButton: true })\nimport { XIcon } from \"lucide-react\"\nimport { Dialog as SheetPrimitive } from \"radix-ui\"\n\nimport { Button } from \"@/components/cubix/button\"\nimport { cn } from \"@/lib/utils\"\n\nfunction Sheet({ ...props }: React.ComponentProps<typeof SheetPrimitive.Root>) {\n  return <SheetPrimitive.Root data-slot=\"sheet\" {...props} />\n}\n\n/*\n  render={<Button variant=\"outline\" />} composes the trigger or close with\n  another element, the same API as the Base UI and React Aria versions.\n  asChild works as well.\n*/\ntype ComposableProps = {\n  render?: React.ReactElement<Record<string, unknown>>\n}\n\nfunction SheetTrigger({\n  render,\n  asChild,\n  children,\n  ...props\n}: React.ComponentProps<typeof SheetPrimitive.Trigger> & ComposableProps) {\n  return (\n    <SheetPrimitive.Trigger\n      data-slot=\"sheet-trigger\"\n      asChild={asChild || render !== undefined}\n      {...props}\n    >\n      {render\n        ? children === undefined\n          ? render\n          : React.cloneElement(render, undefined, children)\n        : children}\n    </SheetPrimitive.Trigger>\n  )\n}\n\nfunction SheetClose({\n  render,\n  asChild,\n  children,\n  ...props\n}: React.ComponentProps<typeof SheetPrimitive.Close> & ComposableProps) {\n  return (\n    <SheetPrimitive.Close\n      data-slot=\"sheet-close\"\n      asChild={asChild || render !== undefined}\n      {...props}\n    >\n      {render\n        ? children === undefined\n          ? render\n          : React.cloneElement(render, undefined, children)\n        : children}\n    </SheetPrimitive.Close>\n  )\n}\n\nfunction SheetPortal({\n  ...props\n}: React.ComponentProps<typeof SheetPrimitive.Portal>) {\n  return <SheetPrimitive.Portal data-slot=\"sheet-portal\" {...props} />\n}\n\nfunction SheetOverlay({\n  className,\n  ...props\n}: React.ComponentProps<typeof SheetPrimitive.Overlay>) {\n  return (\n    <SheetPrimitive.Overlay\n      data-slot=\"sheet-overlay\"\n      className={cn(\n        \"fixed inset-y-0 left-0 z-50 w-screen isolate bg-overlay-strong duration-100 data-[state=open]:animate-in data-[state=open]:fade-in-0 data-[state=closed]:animate-out data-[state=closed]:fade-out-0\",\n        className\n      )}\n      {...props}\n    />\n  )\n}\n\nfunction SheetContent({\n  className,\n  children,\n  side = \"right\",\n  showCloseButton = true,\n  dir = \"rtl\",\n  lang = \"fa\",\n  ...props\n}: React.ComponentProps<typeof SheetPrimitive.Content> & {\n  side?: \"top\" | \"right\" | \"bottom\" | \"left\"\n  showCloseButton?: boolean\n  dir?: \"ltr\" | \"rtl\"\n  lang?: string\n}) {\n  return (\n    <SheetPortal>\n      <SheetOverlay />\n      <SheetPrimitive.Content\n        data-slot=\"sheet-content\"\n        data-side={side}\n        dir={dir}\n        lang={dir === \"rtl\" ? lang : undefined}\n        className={cn(\n          \"group fixed z-50 flex flex-col gap-4 bg-popover bg-clip-padding text-label text-popover-foreground shadow-lg duration-100 data-[side=bottom]:inset-x-0 data-[side=bottom]:w-screen data-[side=bottom]:bottom-0 data-[side=bottom]:h-auto data-[side=bottom]:border-t data-[side=left]:inset-y-0 data-[side=left]:left-0 data-[side=left]:h-full data-[side=left]:w-3/4 data-[side=left]:border-r data-[side=right]:inset-y-0 data-[side=right]:right-0 data-[side=right]:[margin-right:calc(100%-100vw)] data-[side=right]:h-full data-[side=right]:w-3/4 data-[side=right]:border-l data-[side=top]:inset-x-0 data-[side=top]:w-screen data-[side=top]:top-0 data-[side=top]:h-auto data-[side=top]:border-b data-[side=left]:sm:max-w-sm data-[side=right]:sm:max-w-sm data-[state=open]:animate-in data-[state=open]:fade-in-0 data-[side=bottom]:data-[state=open]:slide-in-from-bottom-10 data-[side=left]:data-[state=open]:slide-in-from-left-10 data-[side=right]:data-[state=open]:slide-in-from-right-10 data-[side=top]:data-[state=open]:slide-in-from-top-10 data-[state=closed]:animate-out data-[state=closed]:fade-out-0 data-[side=bottom]:data-[state=closed]:slide-out-to-bottom-10 data-[side=left]:data-[state=closed]:slide-out-to-left-10 data-[side=right]:data-[state=closed]:slide-out-to-right-10 data-[side=top]:data-[state=closed]:slide-out-to-top-10\",\n          className\n        )}\n        {...props}\n      >\n        <SheetChromeContext.Provider value={{ showCloseButton }}>\n          {children}\n        </SheetChromeContext.Provider>\n        \n      </SheetPrimitive.Content>\n    </SheetPortal>\n  )\n}\n\nfunction SheetHeader({ className, children, ...props }: React.ComponentProps<\"div\">) {\n  const { showCloseButton } = React.useContext(SheetChromeContext)\n  return (\n    <div\n      data-slot=\"sheet-header\"\n      className={cn(\n        \"flex flex-row h-14 items-center justify-between gap-2 border-b px-4 text-start\",\n        className\n      )}\n      {...props}\n    >\n      <div className=\"min-w-0 flex-1\">{children}</div>\n      {showCloseButton ? (\n          <SheetPrimitive.Close data-slot=\"sheet-close\" asChild>\n            <Button\n              variant=\"ghost\"\n              className=\"shrink-0\"\n              size=\"icon-sm\"\n            >\n              <XIcon />\n              <span className=\"sr-only\">Close</span>\n            </Button>\n          </SheetPrimitive.Close>\n        ) : null}\n    </div>\n  )\n}\n\nfunction SheetFooter({ className, ...props }: React.ComponentProps<\"div\">) {\n  const ref = React.useRef<HTMLDivElement>(null)\n\n  React.useLayoutEffect(() => {\n    const row = ref.current\n    if (!row) return\n\n    const equalize = () => {\n      if (!row.isConnected) return\n      const controls = Array.from(row.children) as HTMLElement[]\n      if (controls.length < 2) return\n      controls.forEach((el) => el.style.removeProperty(\"min-width\"))\n      const max = Math.max(...controls.map((el) => el.offsetWidth))\n      controls.forEach((el) => el.style.setProperty(\"min-width\", `${max}px`))\n    }\n\n    equalize()\n    document.fonts?.ready.then(equalize)\n    const observer = new ResizeObserver(equalize)\n    observer.observe(row)\n    return () => observer.disconnect()\n  }, [])\n\n  return (\n    <div\n      ref={ref}\n      data-slot=\"sheet-footer\"\n      className={cn(\n        \"mt-auto flex flex-row items-center gap-2 border-t bg-muted/50 px-4 py-3 group-data-[side=left]:[&>*]:flex-1 group-data-[side=right]:[&>*]:flex-1 group-data-[side=top]:[&>*]:flex-1 group-data-[side=bottom]:[&>*]:flex-1 group-data-[side=top]:sm:[&>*]:flex-none group-data-[side=bottom]:sm:[&>*]:flex-none group-data-[side=top]:sm:justify-end group-data-[side=bottom]:sm:justify-end\",\n        className\n      )}\n      {...props}\n      dir=\"ltr\"\n    />\n  )\n}\n\nfunction SheetTitle({\n  className,\n  ...props\n}: React.ComponentProps<typeof SheetPrimitive.Title>) {\n  return (\n    <SheetPrimitive.Title\n      data-slot=\"sheet-title\"\n      className={cn(\"cn-font-heading text-title font-normal\", className)}\n      {...props}\n    />\n  )\n}\n\nfunction SheetDescription({\n  className,\n  ...props\n}: React.ComponentProps<typeof SheetPrimitive.Description>) {\n  return (\n    <SheetPrimitive.Description\n      data-slot=\"sheet-description\"\n      className={cn(\n        \"text-description text-balance text-muted-foreground md:text-pretty *:[a]:underline *:[a]:underline-offset-3 *:[a]:hover:text-foreground\",\n        className\n      )}\n      {...props}\n    />\n  )\n}\n\nexport {\n  Sheet,\n  SheetTrigger,\n  SheetClose,\n  SheetContent,\n  SheetHeader,\n  SheetFooter,\n  SheetTitle,\n  SheetDescription,\n  SheetOverlay,\n  SheetPortal,\n}\n"
    }
  ]
}

