{
  "$schema": "https://cubixflow.ir/schema/registry-item.json",
  "name": "textarea",
  "type": "registry:ui",
  "title": "Text Area",
  "description": "A multiline text control for longer content - messages, notes, and bios.",
  "dependencies": [],
  "registryDependencies": [],
  "files": [
    {
      "path": "components/cubix/textarea.tsx",
      "type": "registry:ui",
      "target": "components/cubix/textarea.tsx",
      "content": "\"use client\"\n\n/*\n  Cubix Text Area - multiline text control.\n\n  Weight 400 and tracking-normal keep IRANSans XV readable; Latin\n  letter-spacing and medium weight look heavy on Arab script. Visual\n  tokens match TextFieldInput (primary focus ring, muted disabled fill).\n  Icons use data-icon=\"inline-start\" like Button / Text Field.\n  Resize grip is always 8x8 with 4px inset from the bottom-end corner.\n*/\nimport * as React from \"react\"\nimport { cva } from \"class-variance-authority\"\n\nimport { cn } from \"@/lib/utils\"\n\nconst textareaControlVariants = cva(\n  \"group/textarea-control relative w-full min-w-0 rounded-lg border border-input bg-transparent transition-colors outline-none has-disabled:cursor-not-allowed has-disabled:border-transparent has-disabled:bg-muted has-disabled:opacity-70 has-[[data-slot=textarea]:focus-visible]:border-primary has-[[data-slot=textarea]:focus-visible]:ring-3 has-[[data-slot=textarea]:focus-visible]:ring-primary/20 has-[[data-slot=textarea]:focus-visible]:ring-offset-1 has-[[data-slot=textarea]:focus-visible]:ring-offset-background has-[[data-slot=textarea][aria-invalid=true]]:border-destructive has-[[data-slot=textarea][aria-invalid=true]]:ring-0 has-[[data-slot=textarea][aria-invalid=true]:focus-visible]:border-destructive has-[[data-slot=textarea][aria-invalid=true]:focus-visible]:ring-0 dark:bg-input/30 dark:has-disabled:bg-muted dark:has-[[data-slot=textarea][aria-invalid=true]]:border-destructive/50 dark:has-[[data-slot=textarea][aria-invalid=true]:focus-visible]:border-destructive/50 dark:has-[[data-slot=textarea][aria-invalid=true]:focus-visible]:ring-0 [&_[data-icon]]:pointer-events-none [&_[data-icon]]:absolute [&_[data-icon]]:top-2.5 [&_[data-icon]]:z-10 [&_[data-icon]]:text-muted-foreground [&_[data-icon=inline-start]]:start-2 [&_[data-icon=inline-end]]:end-2 [&_svg:not([data-slot=textarea-resize-grip])]:pointer-events-none [&_svg:not([data-slot=textarea-resize-grip])]:shrink-0 [&_svg:not([data-slot=textarea-resize-grip]):not([class*='size-'])]:size-6 has-data-[icon=inline-start]:[&_[data-slot=textarea]]:ps-10 has-data-[icon=inline-end]:[&_[data-slot=textarea]]:pe-10 has-[[data-slot=textarea].resize-none]:[&_[data-slot=textarea-resize-grip]]:hidden\"\n)\n\nconst textareaVariants = cva(\n  \"flex field-sizing-content min-h-16 w-full rounded-lg border border-input bg-transparent px-3 py-2.5 font-normal text-label leading-relaxed tracking-normal text-foreground transition-colors outline-none placeholder:text-muted-foreground focus-visible:border-primary focus-visible:ring-3 focus-visible:ring-primary/20 focus-visible:ring-offset-1 focus-visible:ring-offset-background disabled:cursor-not-allowed disabled:border-transparent disabled:bg-muted disabled:text-muted-foreground disabled:placeholder:text-muted-foreground disabled:opacity-70 aria-invalid:border-destructive aria-invalid:ring-0 aria-invalid:focus-visible:border-destructive aria-invalid:focus-visible:ring-0 dark:bg-input/30 dark:disabled:bg-muted dark:aria-invalid:border-destructive/50 dark:aria-invalid:focus-visible:border-destructive/50 [&::-webkit-resizer]:opacity-0\",\n  {\n    variants: {\n      inControl: {\n        true: \"rounded-[inherit] border-0 bg-transparent shadow-none ring-0 focus-visible:border-0 focus-visible:ring-0 focus-visible:ring-offset-0 disabled:bg-transparent disabled:opacity-100 aria-invalid:border-0 aria-invalid:ring-0 aria-invalid:ring-offset-0 dark:bg-transparent dark:disabled:bg-transparent\",\n        false: \"\",\n      },\n    },\n    defaultVariants: {\n      inControl: false,\n    },\n  }\n)\n\nconst TextareaControlContext = React.createContext(false)\n\n/*\n  Design grip: locked 8x8, 4px from the bottom-end corner on every shell.\n  Path is bottom-start; mirrored in LTR for bottom-end.\n*/\nfunction TextareaResizeGrip({ className }: { className?: string }) {\n  return (\n    <svg\n      aria-hidden\n      data-slot=\"textarea-resize-grip\"\n      width=\"8\"\n      height=\"8\"\n      viewBox=\"0 0 8 8\"\n      fill=\"none\"\n      xmlns=\"http://www.w3.org/2000/svg\"\n      className={cn(\n        \"pointer-events-none absolute bottom-[4px] end-[4px] z-10 size-[8px] h-[8px] w-[8px] shrink-0 text-[#D5D8DD] dark:text-border\",\n        \"ltr:-scale-x-100 ltr:origin-center\",\n        className\n      )}\n    >\n      <path\n        fill=\"currentColor\"\n        d=\"M0 4.91653V0L8 8H3.08347C1.38052 8 0 6.61948 0 4.91653Z\"\n      />\n    </svg>\n  )\n}\n\nfunction TextareaControl({\n  className,\n  onClick,\n  children,\n  ...props\n}: React.ComponentProps<\"div\">) {\n  return (\n    <TextareaControlContext.Provider value={true}>\n      <div\n        data-slot=\"textarea-control\"\n        className={cn(textareaControlVariants(), className)}\n        onClick={(event) => {\n          onClick?.(event)\n          if (event.defaultPrevented) return\n          if (\n            (event.target as HTMLElement).closest(\"button,a,input,textarea\")\n          ) {\n            return\n          }\n          const textarea = event.currentTarget.querySelector<HTMLTextAreaElement>(\n            \"[data-slot=textarea]\"\n          )\n          if (!textarea || textarea.disabled || textarea.readOnly) return\n          textarea.focus()\n        }}\n        {...props}\n      >\n        {children}\n        <TextareaResizeGrip />\n      </div>\n    </TextareaControlContext.Provider>\n  )\n}\n\nfunction Textarea({ className, ...props }: React.ComponentProps<\"textarea\">) {\n  const inControl = React.useContext(TextareaControlContext)\n\n  const textarea = (\n    <textarea\n      data-slot=\"textarea\"\n      className={cn(\n        textareaVariants({ inControl }),\n        !inControl && \"w-full\",\n        className\n      )}\n      {...props}\n    />\n  )\n\n  if (inControl) {\n    return textarea\n  }\n\n  return (\n    <div\n      data-slot=\"textarea-root\"\n      className=\"relative w-full has-[[data-slot=textarea].resize-none]:[&_[data-slot=textarea-resize-grip]]:hidden\"\n    >\n      {textarea}\n      <TextareaResizeGrip />\n    </div>\n  )\n}\n\nexport { Textarea, TextareaControl, textareaControlVariants, textareaVariants }\n"
    }
  ]
}

