{
  "$schema": "https://cubixflow.ir/schema/registry-item.json",
  "name": "accordion",
  "type": "registry:ui",
  "title": "Accordion",
  "description": "A vertically stacked set of interactive headings that each reveal a section of content.",
  "dependencies": [
    "@base-ui/react"
  ],
  "registryDependencies": [],
  "files": [
    {
      "path": "components/cubix/accordion.tsx",
      "type": "registry:ui",
      "target": "components/cubix/accordion.tsx",
      "content": "\"use client\"\n\n/*\n  Cubix Accordion - stacked sections that each reveal a panel.\n\n  Single mode keeps one section open and lets the open trigger close it\n  again; multiple mode keeps any number open. ArrowUp and ArrowDown move focus\n  between the enabled triggers of the same accordion (wrapping at the ends),\n  Home and End jump to the first and last one. Layout uses logical\n  properties, so the chevron sits at the inline end and follows dir=\"rtl\"\n  without a flip.\n*/\nimport * as React from \"react\"\nimport { Accordion as AccordionPrimitive } from \"@base-ui/react/accordion\"\nimport { ChevronDownIcon } from \"lucide-react\"\n\nimport { cn } from \"@/lib/utils\"\n\nconst ACCORDION_SELECTOR = '[data-slot=\"accordion\"]'\nconst TRIGGER_SELECTOR = '[data-slot=\"accordion-trigger\"]'\nconst DISABLED_TRIGGER_SELECTOR =\n  ':disabled, [aria-disabled=\"true\"], [data-disabled]'\n\n/*\n  Moves focus from a trigger to a sibling trigger of the same accordion, so a\n  nested accordion keeps its own sequence. Returns true when the key moved\n  focus.\n*/\nfunction focusSiblingTrigger(trigger: EventTarget, key: string) {\n  if (!(trigger instanceof HTMLElement)) return false\n  const root = trigger.closest(ACCORDION_SELECTOR)\n  if (!root) return false\n\n  const triggers = Array.from(\n    root.querySelectorAll<HTMLElement>(TRIGGER_SELECTOR)\n  ).filter(\n    (item) =>\n      item.closest(ACCORDION_SELECTOR) === root &&\n      !item.matches(DISABLED_TRIGGER_SELECTOR)\n  )\n  const index = triggers.indexOf(trigger)\n  if (index === -1) return false\n\n  const last = triggers.length - 1\n  let nextIndex: number\n  switch (key) {\n    case \"ArrowDown\":\n      nextIndex = index === last ? 0 : index + 1\n      break\n    case \"ArrowUp\":\n      nextIndex = index === 0 ? last : index - 1\n      break\n    case \"Home\":\n      nextIndex = 0\n      break\n    case \"End\":\n      nextIndex = last\n      break\n    default:\n      return false\n  }\n\n  triggers[nextIndex]?.focus()\n  return true\n}\n\ntype AccordionProps = Omit<\n  AccordionPrimitive.Root.Props<string>,\n  \"loopFocus\" | \"orientation\"\n>\n\nfunction Accordion({ className, ...props }: AccordionProps) {\n  return (\n    <AccordionPrimitive.Root<string>\n      data-slot=\"accordion\"\n      className={cn(\"flex w-full flex-col\", className)}\n      {...props}\n    />\n  )\n}\n\ntype AccordionItemProps = Omit<AccordionPrimitive.Item.Props, \"value\"> & {\n  value: string\n}\n\nfunction AccordionItem({ className, ...props }: AccordionItemProps) {\n  return (\n    <AccordionPrimitive.Item\n      data-slot=\"accordion-item\"\n      className={cn(\"border-b border-border last:border-b-0\", className)}\n      {...props}\n    />\n  )\n}\n\ntype AccordionTriggerProps = AccordionPrimitive.Trigger.Props & {\n  icon?: React.ReactNode\n}\n\nfunction AccordionTrigger({\n  className,\n  children,\n  icon,\n  onKeyDown,\n  ...props\n}: AccordionTriggerProps) {\n  return (\n    <AccordionPrimitive.Header\n      data-slot=\"accordion-header\"\n      className=\"m-0 flex font-sans text-description font-normal tracking-normal\"\n    >\n      <AccordionPrimitive.Trigger\n        data-slot=\"accordion-trigger\"\n        className={cn(\n          \"group/accordion-trigger flex flex-1 items-center justify-between gap-3 rounded-lg border border-transparent py-3 text-start font-[family-name:var(--font-arab),var(--font-sans),ui-sans-serif,sans-serif] text-label font-medium text-foreground outline-none transition-[color,box-shadow] focus-visible:border-ring focus-visible:ring-3 focus-visible:ring-ring/50 disabled:pointer-events-none disabled:opacity-50 aria-disabled:pointer-events-none aria-disabled:opacity-50 data-disabled:pointer-events-none data-disabled:opacity-50\",\n          className\n        )}\n        onKeyDown={(event) => {\n          onKeyDown?.(event)\n          if (event.isDefaultPrevented()) return\n          if (focusSiblingTrigger(event.currentTarget, event.key)) {\n            event.preventDefault()\n          }\n        }}\n        {...props}\n      >\n        {icon ? (\n          <span\n            data-slot=\"accordion-trigger-title\"\n            className=\"flex min-w-0 items-center gap-2\"\n          >\n            <span\n              data-slot=\"accordion-trigger-icon-start\"\n              aria-hidden=\"true\"\n              className=\"inline-flex shrink-0 items-center [&_svg]:pointer-events-none [&_svg]:shrink-0 [&_svg:not([class*='size-'])]:size-6\"\n            >\n              {icon}\n            </span>\n            {children}\n          </span>\n        ) : (\n          children\n        )}\n        <ChevronDownIcon\n          data-slot=\"accordion-trigger-icon\"\n          aria-hidden=\"true\"\n          className=\"pointer-events-none size-4 shrink-0 text-muted-foreground transition-transform duration-200 ease-out group-aria-expanded/accordion-trigger:rotate-180 motion-reduce:transition-none\"\n        />\n      </AccordionPrimitive.Trigger>\n    </AccordionPrimitive.Header>\n  )\n}\n\ntype AccordionContentProps = Omit<AccordionPrimitive.Panel.Props, \"className\"> & {\n  className?: string\n}\n\nfunction AccordionContent({\n  className,\n  children,\n  ...props\n}: AccordionContentProps) {\n  return (\n    <AccordionPrimitive.Panel\n      data-slot=\"accordion-content\"\n      className=\"h-(--accordion-panel-height) overflow-hidden text-description text-muted-foreground transition-[height] duration-200 ease-out data-ending-style:h-0 data-starting-style:h-0 motion-reduce:transition-none\"\n      {...props}\n    >\n      <div\n        className={cn(\n          \"pt-0 pb-3 [&_a]:underline [&_a]:underline-offset-3 [&_a]:hover:text-foreground\",\n          className\n        )}\n      >\n        {children}\n      </div>\n    </AccordionPrimitive.Panel>\n  )\n}\n\nexport {\n  Accordion,\n  AccordionItem,\n  AccordionTrigger,\n  AccordionContent,\n  type AccordionProps,\n  type AccordionItemProps,\n  type AccordionTriggerProps,\n  type AccordionContentProps,\n}\n"
    }
  ]
}

