{
  "$schema": "https://cubixflow.ir/schema/registry-item.json",
  "name": "kbd",
  "type": "registry:ui",
  "title": "Kbd",
  "description": "A component to display keyboard shortcuts.",
  "dependencies": [],
  "registryDependencies": [],
  "files": [
    {
      "path": "components/cubix/kbd.tsx",
      "type": "registry:ui",
      "target": "components/cubix/kbd.tsx",
      "content": "import * as React from \"react\"\n\nimport { cn } from \"@/lib/utils\"\n\nfunction Kbd({ className, ...props }: React.ComponentProps<\"kbd\">) {\n  return (\n    <kbd\n      data-slot=\"kbd\"\n      className={cn(\n        \"pointer-events-none inline-flex h-5 w-fit min-w-5 items-center justify-center gap-1 rounded-sm bg-muted px-1 font-sans text-caption font-medium text-muted-foreground select-none in-data-[slot=tooltip-content]:bg-background/20 in-data-[slot=tooltip-content]:text-background dark:in-data-[slot=tooltip-content]:bg-background/10 [&_svg:not([class*='size-'])]:size-3\",\n        className\n      )}\n      {...props}\n    />\n  )\n}\n\nfunction KbdGroup({ className, ...props }: React.ComponentProps<\"kbd\">) {\n  return (\n    <kbd\n      data-slot=\"kbd-group\"\n      className={cn(\"inline-flex items-center gap-1\", className)}\n      {...props}\n    />\n  )\n}\n\nexport { Kbd, KbdGroup }\n"
    }
  ]
}

