{
  "$schema": "https://cubixflow.ir/schema/registry-item.json",
  "name": "input",
  "type": "registry:ui",
  "title": "Input",
  "description": "Displays a form input field or a component that looks like an input field.",
  "dependencies": [],
  "registryDependencies": [],
  "files": [
    {
      "path": "components/cubix/input.tsx",
      "type": "registry:ui",
      "target": "components/cubix/input.tsx",
      "content": "import * as React from \"react\"\nimport { cn } from \"@/lib/utils\"\n\nfunction Input({ className, type, ...props }: React.ComponentProps<\"input\">) {\n  return (\n    <input\n      type={type}\n      data-slot=\"input\"\n      className={cn(\n        \"h-8 w-full min-w-0 rounded-lg border border-input bg-transparent px-2.5 py-1 text-base transition-colors outline-none file:inline-flex file:h-6 file:border-0 file:bg-transparent file:text-description file:font-medium file:text-foreground placeholder:text-muted-foreground focus-visible:border-ring focus-visible:ring-3 focus-visible:ring-ring/50 disabled:pointer-events-none disabled:cursor-not-allowed disabled:bg-input/50 disabled:opacity-50 aria-invalid:border-destructive aria-invalid:ring-3 aria-invalid:ring-destructive/20 md:text-description dark:bg-input/30 dark:disabled:bg-input/80 dark:aria-invalid:border-destructive/50 dark:aria-invalid:ring-destructive/40\",\n        className\n      )}\n      {...props}\n    />\n  )\n}\n\nexport { Input }\n"
    }
  ]
}

