{
  "$schema": "https://cubixflow.ir/schema/registry-item.json",
  "name": "streaming-text",
  "type": "registry:ui",
  "title": "Streaming Text",
  "description": "Progressive text surface for token-by-token model output during a stream.",
  "dependencies": [],
  "registryDependencies": [],
  "files": [
    {
      "path": "components/cubix/streaming-text.tsx",
      "type": "registry:ui",
      "target": "components/cubix/streaming-text.tsx",
      "content": "\"use client\"\n\nimport * as React from \"react\"\nimport { cva, type VariantProps } from \"class-variance-authority\"\n\nimport { cn } from \"@/lib/utils\"\n\ntype StreamingTextCaretStyle = \"block\" | \"line\" | \"circle\"\n\ntype StreamingTextContextValue = {\n  isStreaming: boolean\n  caret: StreamingTextCaretStyle | false\n}\n\nconst StreamingTextContext =\n  React.createContext<StreamingTextContextValue | null>(null)\n\nfunction useStreamingText() {\n  const context = React.useContext(StreamingTextContext)\n  if (!context) {\n    throw new Error(\"StreamingText parts must be used within StreamingText.\")\n  }\n  return context\n}\n\nconst streamingTextCaretVariants = cva(\n  \"streaming-caret-blink pointer-events-none inline-block shrink-0 select-none\",\n  {\n    variants: {\n      variant: {\n        line: \"mx-px h-[1.1em] w-px translate-y-[0.12em] bg-foreground/80\",\n        block:\n          \"mx-px h-[1em] w-[0.35ch] translate-y-[0.14em] rounded-sm bg-foreground/75\",\n        circle:\n          \"mx-1 mb-[0.15em] size-1 self-end rounded-full bg-foreground/70\",\n      },\n    },\n    defaultVariants: {\n      variant: \"line\",\n    },\n  }\n)\n\nfunction StreamingTextCaret({\n  className,\n  variant,\n  force,\n  children,\n  ...props\n}: React.ComponentProps<\"span\"> &\n  VariantProps<typeof streamingTextCaretVariants> & {\n    force?: boolean\n  }) {\n  const context = React.useContext(StreamingTextContext)\n  const isStreaming = context?.isStreaming ?? false\n  const resolvedVariant =\n    variant ??\n    (context?.caret == null || context.caret === false\n      ? \"line\"\n      : context.caret)\n\n  if (!force && context && (!isStreaming || context.caret === false)) {\n    return null\n  }\n\n  return (\n    <span\n      data-slot=\"streaming-text-caret\"\n      data-variant={children ? \"custom\" : resolvedVariant}\n      aria-hidden=\"true\"\n      className={cn(\n        children\n          ? \"streaming-caret-blink ms-1 inline-flex shrink-0 items-center\"\n          : streamingTextCaretVariants({ variant: resolvedVariant }),\n        className\n      )}\n      {...props}\n    >\n      {children}\n    </span>\n  )\n}\n\nfunction StreamingText({\n  className,\n  isStreaming = false,\n  caret = \"line\",\n  children,\n  ...props\n}: React.ComponentProps<\"div\"> & {\n  isStreaming?: boolean\n  caret?: StreamingTextCaretStyle | false\n}) {\n  const contextValue = React.useMemo(\n    () => ({ isStreaming, caret }),\n    [isStreaming, caret]\n  )\n\n  return (\n    <StreamingTextContext.Provider value={contextValue}>\n      <div\n        data-slot=\"streaming-text\"\n        data-streaming={isStreaming ? \"\" : undefined}\n        data-caret={caret === false ? \"false\" : caret}\n        aria-busy={isStreaming || undefined}\n        aria-live={isStreaming ? \"polite\" : undefined}\n        className={cn(\n          \"relative min-w-0 text-description leading-relaxed wrap-break-word whitespace-pre-wrap\",\n          className\n        )}\n        {...props}\n      >\n        {children}\n        {caret !== false ? <StreamingTextCaret variant={caret} /> : null}\n      </div>\n    </StreamingTextContext.Provider>\n  )\n}\n\nexport {\n  StreamingText,\n  StreamingTextCaret,\n  useStreamingText,\n  streamingTextCaretVariants,\n  type StreamingTextCaretStyle,\n}\n"
    }
  ]
}

