{
  "$schema": "https://cubix.design/schema/registry-item.json",
  "name": "dialog",
  "type": "registry:ui",
  "title": "Dialog",
  "description": "A modal window overlaid on the primary content for focused tasks, forms, and secondary flows.",
  "dependencies": ["@base-ui/react", "lucide-react"],
  "registryDependencies": ["button"],
  "files": [
    {
      "path": "components/cubix/dialog.tsx",
      "type": "registry:ui",
      "target": "components/cubix/dialog.tsx"
    }
  ]
}
